Title,Author,PublishedAt,Description,URL
"MicroStrategy’s $26 billion Bitcoin cache is larger than IBM, Nike cash holdings","Monique Mulima, Bloomberg",2024-11-16T17:16:52Z,"Only about a dozen companies, led by Apple Inc. and Alphabet Inc., hold more assets in their corporate treasuries.",https://fortune.com/crypto/2024/11/16/microstrategy-26-billion-bitcoin-cryptocurrency-cache-ibm-nike-cash-holdings/
"Samsung Slashes Galaxy S24 Price In New Sale, Last Chance","Janhoi McGregor, Senior Contributor, 
 Janhoi McGregor, Senior Contributor
 https://www.forbes.com/sites/jaymcgregor/",2024-10-29T16:12:09Z,Samsung has launched another early Black Friday sale for the Galaxy S24 Ultra.,https://www.forbes.com/sites/jaymcgregor/2024/10/29/samsung-galaxy-s24-ultra-black-friday-sale-discount-twenty/
Samsung Leak Reveals Surprise New Galaxy Z Fold Model,"Janhoi McGregor, Senior Contributor, 
 Janhoi McGregor, Senior Contributor
 https://www.forbes.com/sites/jaymcgregor/",2024-10-28T15:31:06Z,Samsung has a brand new Fold up its sleeve.,https://www.forbes.com/sites/jaymcgregor/2024/10/28/samsung-galaxy-z-fold-7-leak-new-model-galaxy-z-fold-6-se/
APPLE-SA-10-28-2024-5 macOS Ventura 13.7.1,,2024-10-29T01:54:11Z,"Posted by Apple Product Security via Fulldisclosure on Oct 28APPLE-SA-10-28-2024-5 macOS Ventura 13.7.1

macOS Ventura 13.7.1 addresses the following issues.
Information about the security content is also available at
https://support.apple.com/121568.

Apple …",https://seclists.org/fulldisclosure/2024/Oct/13
APPLE-SA-10-28-2024-4 macOS Sonoma 14.7.1,,2024-10-29T01:54:09Z,"Posted by Apple Product Security via Fulldisclosure on Oct 28APPLE-SA-10-28-2024-4 macOS Sonoma 14.7.1

macOS Sonoma 14.7.1 addresses the following issues.
Information about the security content is also available at
https://support.apple.com/121570.

Apple ma…",https://seclists.org/fulldisclosure/2024/Oct/12
"Apple's next device is an AI wall tablet for home control, Siri, and video calls",DIGITIMES,2024-11-13T09:41:16Z,"Apple Inc., aiming to catch up with rivals in the smart home market, is nearing the launch of a new product category: a wall-mounted display that can control appliances, handle videoconferencing, and use AI to navigate apps.",https://www.digitimes.com/news/a20241113VL205/apple-smart-home-apple-intelligence-market-siri.html
Indonesia Blocks Sale of Apple’s iPhone 16,Claire Jiao,2024-10-28T02:59:05Z,"(Bloomberg) -- Indonesia has blocked Apple Inc. from selling its latest iPhone 16 devices in Southeast Asia’s largest economy, saying the company has yet to ...",https://finance.yahoo.com/news/indonesia-blocks-sale-apple-iphone-025905821.html
Intel is being kicked off a key Dow Jones Index — and Nvidia is taking its place,Craig Hale,2024-11-04T11:29:00Z,"Nvidia, with its $3 trillion market cap, replaces Intel in the Dow Jones Industrial Average index.",https://www.techradar.com/pro/intel-is-being-kicked-off-a-key-dow-jones-index-and-nvidia-is-taking-its-place
Apple、「Apple Intelligence」を提供開始,Al,2024-10-28T17:58:04Z,Apple Inc.が、「iOS 18.1」「iPadOS 18.1」「macOS Sequoia 15.1」と、「tvOS 18.1」「watchOS 11.1」「visionOS 2.1」をリリースしています。 iO … 続きを読む Apple、「Apple Intelligence」を提供開始 →,https://www.applelinkage.com/2024/10/29/apple-intelligence-is-available-today/
Buffett’s Berkshire Buys Stakes in Domino’s and Pool Corp.,Alexandre Rajbhandari,2024-11-14T22:22:34Z,(Bloomberg) -- Berkshire Hathaway Inc. bought stock in Domino’s Pizza Inc. and Pool Corp. during the third quarter as Chairman Warren Buffett cut back on...,https://finance.yahoo.com/news/buffett-berkshire-buys-stakes-domino-214111506.html
"What is Cosmos, the Pinterest alternative for creatives?",joe.foley@futurenet.com (Joe Foley),2024-11-05T07:00:00Z,Great UI design and no 'likes' are drawing people to the new social media platform.,https://www.creativebloq.com/design/social-media/what-is-cosmos-the-pinterest-alternative-for-creatives
Best Design Apps for the Creative Industry,Sarang Sheth,2024-11-10T12:40:27Z,Best Design Apps for the Creative IndustryDid you know that over 70% of designers report using multiple tools in their workflow? The world of design is not just about creativity; it’s...,https://www.yankodesign.com/2024/11/10/best-design-apps-for-the-creative-industry/
Apple Faces UK Class Action Over Data Storage Allegations,Admin,2024-11-14T09:29:56Z,"Apple Inc. faces a lawsuit from a UK consumer group over allegations its monopoly on data storage breaches competition law, in a fresh class action that could ultimately cost the tech giant billions. The iCloud provider is accused of abusing …",https://www.insurancejournal.com/news/international/2024/11/14/801123.htm
APPLE-SA-10-28-2024-8 visionOS 2.1,,2024-10-29T01:54:17Z,"Posted by Apple Product Security via Fulldisclosure on Oct 28APPLE-SA-10-28-2024-8 visionOS 2.1

visionOS 2.1 addresses the following issues.
Information about the security content is also available at
https://support.apple.com/121566.

Apple maintains a Secu…",https://seclists.org/fulldisclosure/2024/Oct/16
"Today Apple won 67 patents covering future Foldable Device Displays, Digital Car Keys and more",Jack Purcher,2024-11-12T15:58:39Z,"Today the U.S. Patent and Trademark Office officially published a series of 67 newly granted utility patents for Apple Inc. In this particular report we cover a patent focused on future foldable device displays and car Keys And, as always, we wrap up this wee…",https://www.patentlyapple.com/2024/11/today-apple-won-67-patents-covering-future-foldable-device-displays-digital-car-keys-and-more.html
Apple less vulnerable to President Trump’s tariffs than ‘many might believe’ – Bernstein,MacDailyNews,2024-11-06T21:02:00Z,"Apple is less vulnerable to increased trade tariffs from President Donald Trump, Bernstein analysts said Wednesday. Bernstein estimated…
The post Apple less vulnerable to President Trump’s tariffs than ‘many might believe’ – Bernstein appeared first on MacDai…",https://macdailynews.com/2024/11/06/apple-less-vulnerable-to-president-trumps-tariffs-than-many-might-believe-bernstein/
"Kogan 50"" LED 4K Smart Roku TV $355 Delivered ($325 for FIRST Members) @ Kogan - Black friday sale",TerryJustTerry,2024-11-25T03:42:08Z,"Cheap 4k TV - comes in a couple of sizes.

43"" - $319 (Or $305 for Kogan First member)
50"" - $355 (Or $325 for Kogan First member)
55"" - $449 (Or $429 for Kogan First member)
65"" - $599 (Or $579 for Kogan First member)
75"" - $929 (Or $899 for Kogan First memb…",https://www.ozbargain.com.au/node/879876
Evercore Identifies Apple Inc. (AAPL) as Key Stock to Watch Amid Potential Impact of Trump Tariffs and Policy Shifts on IT Hardware Firms,,2024-11-11T01:13:37Z,,https://consent.yahoo.com/v2/collectConsent?sessionId=1_cc-session_ca7b15ea-c770-4e62-a310-8529e998062e
Apple chief returns to China as Beijing prepares to fete CEOs,DIGITIMES,2024-11-25T09:38:08Z,"Apple Inc. Chief Executive Officer Tim Cook is visiting China for at least the third time this year, showing up at a suppliers' conference on the same day a top Beijing official convened an important meeting with a group of foreign CEOs.",https://www.digitimes.com/news/a20241125VL202/tim-cook-beijing-apple-china-supply-chain.html
Indonesia to assess $100m Apple bid to end iPhone 16 ban,Bloomberg,2024-11-21T04:44:00Z,"<p>Indonesia is set to assess a US$100 million investment proposal from Apple Inc, as the American tech giant attempts to coax the government to unblock its sales ban on the iPhone 16.</p>",https://www.bangkokpost.com/business/general/2905726/indonesia-to-assess-100m-apple-bid-to-end-iphone-16-ban
Abu Ghraib Torture Trial Against Virginia-Based Defense Contractor Begins Again,Sanya Mansoor,2024-10-31T17:15:00Z,"Against the odds, three Iraqi men could bring CACI to justice for the government contractor’s alleged role in Abu Ghraib abuses.
The post Abu Ghraib Torture Trial Against Virginia-Based Defense Contractor Begins Again appeared first on The Intercept.",https://theintercept.com/2024/10/31/abu-ghraib-torture-trial-caci/
"Jim Cramer on Apple Inc. (AAPL)’s iPhone Sales: ‘Not Enough To Make Me Wanna Sell, But Enough To Ding The Stock’",,2024-10-25T23:35:04Z,,https://consent.yahoo.com/v2/collectConsent?sessionId=1_cc-session_8cdba509-ac02-4b59-8652-483dcff26b94
"Apple to launch an AI Home Display in 2025 with a built-in camera for Home Security, controlling appliances and much more",Jack Purcher,2024-11-12T23:17:57Z,"According to a new Bloomberg report, “Apple Inc., aiming to catch up with rivals in the smart home market, is nearing the launch of a new product category: a wall-mounted display that can control appliances, handle videoconferencing and use AI to navigate app…",https://www.patentlyapple.com/2024/11/apple-to-launch-an-ai-home-display-in-2025-with-a-built-in-camera-for-home-security-controlling-appliances-and-much-more.html
"HomePad? Apple said to unveil AI wall tablet for home control, Siri and FaceTime calls as early as March 2025",MacDailyNews,2024-11-12T21:09:51Z,"Apple, aiming push more urgently into the smart home market, is said to be nearing the launch of a new product category: a wall-mounted…
The post HomePad? Apple said to unveil AI wall tablet for home control, Siri and FaceTime calls as early as March 2025 app…",https://macdailynews.com/2024/11/12/homepad-apple-said-to-unveil-ai-wall-tablet-for-home-control-siri-and-facetime-calls-as-early-as-march-2025/
"After iPhone 16, Indonesia Halts Sale of Google Pixel Phones",Claire Jiao and Eko Listiyorini,2024-11-01T05:03:41Z,"(Bloomberg) -- Indonesia has prohibited the sale of the Pixel phones, saying Alphabet Inc.’s Google has failed to meet domestic content requirements.Most...",https://finance.yahoo.com/news/iphone-16s-indonesia-blocks-google-035416564.html
Compulocks、新デザインのMac mini (2024)に対応したセキュリティロックマウント「Maclocks Mac mini M4 2024 Security Mount with Lock Head」を発売。,applech2,2024-11-14T21:18:01Z,"CompulocksがApple M4チップ搭載のMac mini (2024)に対応したセキュリティロックマウント「Maclocks Mac mini M4 2024 Security Mount with Lock […]
The post Compulocks、新デザインのMac mini (2024)に対応したセキュリティロックマウント「Maclocks Mac mini M4 2024 Security Mount with Lock Head」を発売。 first appeared on AAPL C…",https://applech2.com/archives/20241115-maclocks-mac-mini-m4-2024-security-mount-with-lock-head.html
Workday Inc. (WDAY): Resilient Growth Amid Economic Challenges and Focus on Profit Expansion,Ramish Cheema,2024-11-25T22:11:38Z,"We recently compiled a list of the Wells Fargo’s Best Growth Stocks: 28 Stocks With The Highest Consensus EPS Growth Estimates. In this article, we are going...",https://finance.yahoo.com/news/workday-inc-wday-resilient-growth-221138726.html
5G Americas-Influencing The Future Of The Wireless Industry,"Tim Bajarin, Contributor, 
 Tim Bajarin, Contributor
 https://www.forbes.com/sites/timbajarin/",2024-10-29T14:00:00Z,5G Americas is the group representing the carriers and telecom industry in the Americas and a critical force driving next-generation wireless trends and standards.,https://www.forbes.com/sites/timbajarin/2024/10/29/5g-americas-influencing-the-future-of-the-wireless-industry/
"Apple was granted 76 patents today covering Virtual Paper, a No Notch iPhone, 2 Master Vision Pro Patents and more",Jack Purcher,2024-11-19T23:40:34Z,"Today the U.S. Patent and Trademark Office officially published a series of 76 newly granted utility patents for Apple Inc. In this particular report we briefly cover patents for virtual paper, a no notch iPhone and multiple HMD patents including two master V…",https://www.patentlyapple.com/2024/11/apple-was-granted-76-patents-today-covering-virtual-paper-a-no-notch-iphone-2-master-vision-pro-patents-and-more.html
One Inc and US Bank team on insurance payments,Editorial Team,2024-11-21T21:33:00Z,"One Inc, the leading payments network for the insurance industry, announced today a partnership with U.S. Bank aimed at delivering a comprehensive, unified payment experience for Property & Casualty (P&C) and Life insurers.",https://www.finextra.com/pressarticle/103316/one-inc-and-us-bank-team-on-insurance-payments
Markets Pricing In Extreme Volatility For The Week,"JJ Kinahan, Senior Contributor, 
 JJ Kinahan, Senior Contributor
 https://www.forbes.com/sites/jjkinahan/",2024-11-04T12:44:06Z,"According to FactSet, between those who have reported and what is expected from those scheduled to report, the blended earnings growth rate for the quarter is tracking...",https://www.forbes.com/sites/jjkinahan/2024/11/04/markets-pricing-in-extreme-volatility-for-the-week/
"Today’s iOS price drops and freebies: Moncage, Transport INC, BE-A Walker, ELOH, more",Justin Kahn,2024-11-22T14:53:52Z,"Amazon’s Black Friday Week Deals are here and so are your Friday App Store price drops. Alongside ongoing all-time lows on the Black Apple Watch Ultra 2 and Apple Watch Series 10, this morning ushered in the best prices to date on on the M3 MacBook Air with 1…",http://9to5toys.com/2024/11/22/ios-price-drops-freebies-moncage/
Warren Buffett’s Berkshire Hathaway Continues Selling Off Apple Stock,Bruce Haring,2024-11-02T23:25:20Z,"The investment titan's company remains the iPhone manufacturer's largest stockholder
The post Warren Buffett’s Berkshire Hathaway Continues Selling Off Apple Stock appeared first on TheWrap.",https://www.thewrap.com/warren-buffett-berkshire-hathaway-apple/
"Planet Fitness, Inc. (PLNT): Leveraging Membership Growth and Real Estate Opportunities for Expansion",Ramish Cheema,2024-11-25T20:28:17Z,"We recently compiled a list of the Wells Fargo’s Best Growth Stocks: 28 Stocks With The Highest Consensus EPS Growth Estimates. In this article, we are going...",https://finance.yahoo.com/news/planet-fitness-inc-plnt-leveraging-202817285.html
