Title,Author,PublishedAt,Description,URL
Australia To Make Big Tech Liable For Citizens' Online Safety,BeauHD,2024-11-15T13:00:00Z,"An anonymous reader quotes a report from Bloomberg: The Australian government plans to enact laws requiring big tech firms to protect its citizens online, the latest move by the center-left Labor administration to crack down on social media including through …",https://yro.slashdot.org/story/24/11/15/0114233/australia-to-make-big-tech-liable-for-citizens-online-safety
Budget Apple Vision Pro could be slimmer and brighter,news@appleinsider.com (William Gallagher),2024-11-06T12:26:17Z,"Apple is still deciding on the displays for its expected lower-cost Apple Vision Pro, but is close to settling on a lower resolution screen that is brighter and also thinner than in the current headset.Inside of Apple Vision ProBack in 2023, it was believed t…",https://appleinsider.com/articles/24/11/06/budget-apple-vision-pro-could-be-slimmer-and-brighter
"There will never be an Apple Ring, says rival with crossed fingers",news@appleinsider.com (William Gallagher),2024-11-13T11:58:58Z,"The CEO of smart ring firm Oura has detailed the reasons there shouldn't be an Apple Ring, but sounds like he's hoping Apple is listening.Render of a possible Apple RingOh, just bring out a ring already. Apple Ring has been rumored for years, but in the last …",https://appleinsider.com/articles/24/11/13/there-will-never-be-an-apple-ring-says-rival-with-crossed-fingers
Apple is Killing Swift – A great language strangled by governance,Jacob Bartlett,2024-10-29T03:49:33Z,A great language strangled by governance,https://blog.jacobstechtavern.com/p/apple-is-killing-swift
Tim Cook and 20 other CEOs met China’s premier to discuss potential issues with Trump plans,Ben Lovejoy,2024-11-25T15:12:00Z,"Apple CEO Tim Cook and more than 20 other chief execs met China’s premier today to discuss potential trade disruption once Trump takes office in January.



However, the report makes it sound like the meeting didn’t achieve much, with some saying it felt scri…",https://9to5mac.com/2024/11/25/tim-cook-and-20-other-ceos-met-chinas-premier-to-discuss-potential-issues-with-trump-plans/
"Apple will now be treated like a bank, says US Consumer Financial Protection Bureau",Ben Lovejoy,2024-11-21T12:09:08Z,"The popularity of Apple Pay will now see the Cupertino company regulated by the US Consumer Financial Protection Bureau (CFPB), a watchdog whose role is normally limited to banks and financial services companies.



The decision means that the bureau will hav…",https://9to5mac.com/2024/11/21/apple-will-now-be-treated-like-a-bank-says-us-consumer-financial-protection-bureau/
Apple Is Reportedly Looking To Develop Its Own Smart Glasses,info@hypebeast.com (Hypebeast),2024-11-06T06:50:36Z,"Apple is looking to new innovative ventures. Following Meta's footsteps, Apple is reportedly looking to develop its own smart glasses. According to Bloomberg, the iPhone maker is moving into AI eyewear after its Apple Vison Pro headset.Apple recently conducte…",https://hypebeast.com/2024/11/apple-developing-own-smart-glasses-reports
"The Rabbit R1 at 6 Months: Surprisingly Smarter, but Still Overshadowed by Our Phones",Lisa Eadicicco,2024-11-12T13:00:00Z,Commentary: The Rabbit R1 is much more functional and capable than it was at launch. But it still feels unnecessary alongside your smartphone.,https://www.cnet.com/tech/mobile/the-rabbit-r1-at-6-months-surprisingly-smarter-but-still-overshadowed-by-our-phones/
Apple to Offer Extra Indonesia Investment to Remove iPhone Ban,Faris Mokhtar,2024-11-05T00:57:59Z,"(Bloomberg) -- Apple Inc. has proposed investing almost $10 million to make additional goods in Indonesia, according to people familiar with the matter, as...",https://finance.yahoo.com/news/apple-offer-extra-indonesia-investment-005759988.html
Apple Tests Blood-Sugar App in Sign of Its Health Ambitions,Mark Gurman,2024-10-25T17:16:02Z,"(Bloomberg) -- Apple Inc., seeking to make further inroads in health care, tested an app this year to help people with prediabetes manage their food intake...",https://finance.yahoo.com/news/apple-tests-blood-sugar-app-171602061.html
Indonesia Blocks Sale of Apple iPhone 16 in Bid For Investment,Claire Jiao,2024-10-28T02:59:05Z,"(Bloomberg) -- Indonesia has blocked Apple Inc. from selling its latest iPhone 16 devices in Southeast Asia’s largest economy, saying the company has yet to ...",https://finance.yahoo.com/news/indonesia-blocks-sale-apple-iphone-025905581.html
Deteriorating building causes road closures in New Orleans,Bella Dardano,2024-11-24T19:25:12Z,The City of New Orleans has announced two street closures due to safety concerns involving a deteriorating building.,https://wgno.com/news/louisiana/orleans-parish/deteriorating-building-causes-road-closures-in-new-orleans/
North Korean Hackers Target macOS Using Flutter-Embedded Malware,info@thehackernews.com (The Hacker News),2024-11-12T13:00:00Z,"Threat actors with ties to the Democratic People's Republic of Korea (DPRK aka North Korea) have been found embedding malware within Flutter applications, marking the first time this tactic has been adopted by the adversary to infect Apple macOS devices.
Jamf…",https://thehackernews.com/2024/11/north-korean-hackers-target-macos-using.html
This AI 2D-to-3D video generator signals a new era for album art,joe.foley@futurenet.com (Joe Foley),2024-11-07T16:26:46Z,Immersity AI can add motion to Apple Music covers.,https://www.creativebloq.com/ai/this-ai-2d-to-3d-video-generator-signals-a-new-era-for-album-art
Haiku OS’s Beta 5 Release Brings Us Into a New BeOS Era,Maya Posch,2024-10-30T17:00:38Z,"The name BeOS is one which tends to evoke either sighs of nostalgia or blank stares, mostly determined by one’s knowledge of the 1990s operating system scene. Originally released in …read more",https://hackaday.com/2024/10/30/haiku-oss-beta-5-release-brings-us-into-a-new-beos-era/
A lawsuit accuses Bain Capital's PowerSchool of trafficking in student data. The edtech giant says everything it does is legal.,Laura Italiano,2024-11-04T10:28:01Z,PowerSchool manages data for more than 60 million students and their educators.,https://www.businessinsider.com/edtech-powerschool-sells-student-data-lawsuit-2024-10
Which stocks are in the Magnificent 7?,Vinamrata Chaturvedi,2024-10-28T11:49:00Z,"The “Magnificent 7” refers to a group of seven high-performing tech stocks that drive much of the market’s growth, particularly during market rallies. These companies have significantly influenced stock market performance, accounting for a large share of the …",https://qz.com/magnificent-7-stocks-aapl-nvda-msft-goog-amzn-meta-tsla-1851681874
Nvidia overtakes Apple as world's most valuable firm,breakingthenews.net,2024-11-05T21:48:17Z,"Nvidia Corporation surpassed Apple Inc. as the world's most valuable business by market capitalization, the Companies Market Cap website showed on Tuesday.According to the calculation, Nvidia's value ...",https://biztoc.com/x/5c39f5c915e018af
"The S&P 500 is about to have a big year, Goldman Sachs says — even without the 'Magnificent 7'",Vinamrata Chaturvedi,2024-11-19T20:11:00Z,"After Morgan Stanley’s (MS) bullish outlook, another financial giant has joined the optimistic chorus for the S&P 500 in 2025. What’s more, it expects the growth of the S&P 500 to occur without relying on the outperformance of the Magnificent Seven, marking a…",https://qz.com/goldman-sachs-s-p-500-magnificent-seven-1851703165
Apple Hospitality REIT: Q3 Earnings Snapshot,finance.yahoo.com,2024-11-04T21:45:52Z,"RICHMOND, Va. (AP) — Apple Hospitality REIT Inc. (APLE) on Monday reported a key measure of profitability in its third quarter. The results matched Wall Street expectations.
The Richmond, Virginia-based real estate investment trust said it had funds from oper…",https://biztoc.com/x/32629fea8972c7a2
Warren Buffett cuts Apple stake as his cash pile hits record $325.2 billion,financialpost.com,2024-11-04T15:30:30Z,"Berkshire Hathaway Inc.’s cash pile reached US$325.2 billion in the third quarter, a record for the conglomerate, as Warren Buffett continued to refrain from major acquisitions while trimming some of his most significant equity stakes.
Berkshire once again cu…",https://biztoc.com/x/21b048f1149625f5
"iOS 18.1 is finally here, but this is not the Apple Intelligence you’ve been looking for",Graham Barlow,2024-10-28T16:54:35Z,The launch of Apple Intelligence is not very Apple at all. We're getting Apple Intelligence a piece at a time.,https://www.techradar.com/computing/artificial-intelligence/ios-18-1-is-finally-here-but-this-is-not-the-apple-intelligence-youve-been-looking-for
That famous artist you love probably isn't as rich as you think,Callie Ahlgrim,2024-11-21T19:17:07Z,"In 2024, artists can't survive on talent or fame alone. Streaming, TikTok, inflation, and the ballooning costs of touring have altered a musician's routes to making money.",https://www.businessinsider.com/why-musicians-arent-making-money-streaming-record-labels-and-tiktok-2024-11
"Apple fiscal Q4 results top estimates amid record iPhone sales, but services miss",investing.com,2024-10-31T21:13:43Z,"Investing.com - Apple reported fiscal fourth-quarter results that topped analyst expectations, underpinned by a record quarter of iPhone sales though its key services business fell short of estimates.
Apple Inc (NASDAQ:AAPL) shares fell more than 1% in afterh…",https://biztoc.com/x/cbb40bc4adda9a4e
"Comparing PayPal, Venmo, Zelle and Cash App, by the numbers",Deena Zaidi,2024-10-29T09:00:00Z,"Peer-to-peer payments are changing the retail landscape, with major names such as Starbucks and Walmart embracing the convenient and flexible payment option. According to a recent report by PYMNTS intelligence, 51% of consumers use P2P payments in the U.S.Rea…",https://qz.com/payments-paypal-venmo-zelle-cash-app-apple-comparison-1851678797
Apple's iOS 18.1 Update Adds 'Inactivity Reboot' To Lock Down Unused iPhones — Here's How It Protects Your Privacy,benzinga.com,2024-11-11T09:54:06Z,"Apple Inc. (NASDAQ:AAPL) has introduced an automatic reboot feature for idle iPhones in its latest iOS 18.1 update to bolster device security. 
What Happened: The new iOS 18.1 update includes a hidden feature that triggers an automatic reboot of an iPhone tha…",https://biztoc.com/x/8bfc6d3336b4bf0d
Nvidia Adds Ex-NASA Space Center Director Ellen Ochoa to Board,Ian King,2024-11-07T22:07:37Z,"(Bloomberg) -- Nvidia Corp., the world’s most valuable company, named NASA veteran Ellen Ochoa as a director, expanding the size of its board to 13 members. ...",https://finance.yahoo.com/news/nvidia-adds-ex-nasa-space-220737762.html
Drake Accuses Universal Music Group and Spotify of “Illegally” Boosting Kendrick Lamar’s “Not Like Us” Streams in New Legal Filing,Nina Corcoran,2024-11-26T01:49:24Z,"Attorneys for Drake’s company, Frozen Moments LLC, claim the label used bots, payments, and more to inflate Lamar’s song",https://pitchfork.com/news/drake-accuses-universal-music-group-and-spotify-of-illegally-boosting-kendrick-lamars-not-like-us-streams-in-new-legal-filing/
Apple might be working on AR smart glasses to compete with Meta,David Uzondu,2024-11-05T13:50:01Z,Apple is looking to enter the smart glasses market by gathering feedback from focus groups to see what users like. Read more...,https://www.neowin.net/news/apple-might-be-working-on-ar-smart-glasses-to-compete-with-meta/
Today in Apple history: Newton MessagePad makes its last stand,Luke Dormehl,2024-11-07T16:15:24Z,"On November 7, 1997, Apple released the Newton MessagePad 2100, a PDA that became the final iteration of the line of early handheld devices.
(via Cult of Mac - Apple news, rumors, reviews and how-tos)",https://www.cultofmac.com/apple-history/newton-messagepad-2100
Strong iPhone sales return Apple to record revenue,Ed Hardy,2024-10-31T20:49:44Z,"Apple's Q4 2024 results reveal record revenue and strong iPhone performance. Get the details on the company's financial success and growth.
(via Cult of Mac - Apple news, rumors, reviews and how-tos)",https://www.cultofmac.com/news/apple-earnings-q4-2024
"Eric Paulsen, WWL anchor of 40+ years, dies after battle with cancer",Christian Olivier,2024-10-26T20:16:49Z,"Eric Paulsen, the legendary WWL news anchor, died on Saturday following a battle with cancer. He served the Greater New Orleans community for over 40 years.",https://wgno.com/news/louisiana/orleans-parish/eric-paulsen-wwl-anchor-of-40-years-dies-after-battle-with-cancer/
"Qualcomm RISCs, Arm Pulls: The Legal Battle for the Future of Client Computing",Babbage,2024-11-16T03:06:29Z,What happens when a gladiator takes on the “Warren Buffett of Japan”?,https://thechipletter.substack.com/p/qualcomm-riscs-arm-pulls-the-legal
Scykei: A rising star in the global wearable market,Staff editor,2024-11-12T13:50:21Z,"NEWS – Scykei Technology, Inc., a New York-based tech brand, announced its mission to challenge the status quo and redefine the technology industry. With a bold vision to become a generation-defining tech company, Scykei is poised to make waves in the wearabl…",https://the-gadgeteer.com/2024/11/12/scykei-a-rising-star-in-the-global-wearable-market/
Apple Intelligence rollout begins on eligible devices,CBS News,2024-10-28T14:03:00Z,"Your iPhone could become a whole lot smarter Monday with the launch of Apple Intelligence, introducing a slew of AI features on eligible devices. CNET editor-at-large Bridget Carey joined CBS News to discuss the new features.",https://www.cbsnews.com/video/apple-intelligence-rollout-beginning-on-eligible-devices/
Meta Delivers Strong Q3 Report And Upbeat Holiday Outlook; Daily Active Users Grow 5% To Nearly 3.3B,Dade Hayes,2024-10-30T20:30:57Z,"Meta Platforms handily beat Wall Street analysts’ estimates in the third quarter, offering an upbeat view of the holiday quarter as its social networks combined to reach almost 3.3 billion daily users. Earnings per share jumped 37% from the year-earlier perio…",http://deadline.com/2024/10/meta-platforms-q3-earnings-facebook-1236162526/
"Apple Loop: iPhone 17 Pro Design Leaks, Happy Birthday iPod, Explaining Apple’s AI Delay","Ewan Spence, Senior Contributor, 
 Ewan Spence, Senior Contributor
 https://www.forbes.com/sites/ewanspence/",2024-10-25T19:38:27Z,"This week’s Apple headlines; Phone 17 Pro leaks, MacBook Pro launch dates, iPad Mini review, Apple’s AI delay, hearing health on AirPods, Happy Birthday to the iPod, and more.",https://www.forbes.com/sites/ewanspence/2024/10/25/apple-news-headlines-iphone-17-pro-design-leak-ipad-mini-review-macbook-pro-launch-ipod/
"YouTube topping Spotify, Apple in podcast market, new survey finds",CBS News,2024-11-21T14:16:00Z,"New data from Edison Research shows more people are listening to their podcasts on YouTube than Spotify or Apple. Sean Burch, tech and business reporter for the Wrap, joined CBS News to discuss the survey.",https://www.cbsnews.com/video/youtube-topping-spotify-apple-in-podcast-market/
"Jim Cramer on Apple Inc. (AAPL): ‘I Would Wait For A Dip Because The Bears Are All Over It, Every Minute Of The Day’",Syeda Seirut Javed,2024-11-20T22:42:45Z,"We recently compiled a list of the Jim Cramer’s Lightning Round: 8 Stocks to Watch. In this article, we are going to take a look at where Apple Inc...",https://finance.yahoo.com/news/jim-cramer-apple-inc-aapl-224245077.html
"WEBTOON, Dot Inc. Join Forces To Deliver ‘World’s First Tactile Comics’ To All","Steven Aquino, Contributor, 
 Steven Aquino, Contributor
 https://www.forbes.com/sites/stevenaquino/",2024-11-01T19:17:33Z,"Two series, ""Yumi’s Cells"" and ""Hooky,"" will be available in Braille, free of charge, in an effort to ""[expand] access to more fans around the world.""",https://www.forbes.com/sites/stevenaquino/2024/11/01/webtoon-dot-inc-join-forces-to-deliver-worlds-first-tactile-comics--to-all/
10/28: CBS Morning News,CBS News,2024-10-28T14:00:32Z,Trump holds divisive rally at Madison Square Garden; Apple Intelligence rollout begins.,https://www.cbsnews.com/video/102824-cbs-morning-news/
Is Apple Inc. (AAPL) Still a Key Fixture in Warren Buffett’s Portfolio?,,2024-11-24T13:22:44Z,,https://consent.yahoo.com/v2/collectConsent?sessionId=1_cc-session_3dcb8d39-ee03-4ee1-a616-d273471512a8
Berkshire Hathaway’s Cash Pile Reaches Record $325.2 Billion,Alexandre Rajbhandari,2024-11-02T13:20:33Z,"(Bloomberg) -- Berkshire Hathaway Inc.’s cash pile reached $325.2 billion in the third quarter, a record for the conglomerate, as Warren Buffett continued to...",https://finance.yahoo.com/news/berkshire-hathaway-cash-pile-reaches-122907911.html
Apple iPhone 16 sales blocked in Indonesia due to local parts rule,Reuters,2024-10-28T09:45:59Z,Tech giant Apple Inc will not be allowed to sell its iPhone 16 smartphones in Indonesia because they have not met the country's rules on the use of locally...,https://finance.yahoo.com/news/apple-iphone-16-sales-blocked-094559342.html
Nvidia Set to Replace Intel in the Dow Jones Industrial Average,Jeran Wittenstein and Jessica Menton,2024-11-01T23:39:51Z,"(Bloomberg) -- Nvidia Corp., the chipmaker at the heart of the artificial intelligence boom, is joining the oldest of Wall Street’s three main equity...",https://finance.yahoo.com/news/nvidia-set-replace-intel-dow-231147426.html
Samsung Galaxy S24 Ultra Price Drops In Major New Best Buy Deal,"Janhoi McGregor, Senior Contributor, 
 Janhoi McGregor, Senior Contributor
 https://www.forbes.com/sites/jaymcgregor/",2024-11-19T17:31:37Z,Best Buy has beaten Samsung to the punch with huge Galaxy S24 discounts.,https://www.forbes.com/sites/jaymcgregor/2024/11/19/samsung-galaxy-s24-ultra-best-buy-black-friday-deal-promotion/
"Apple Inc. (AAPL) Unveils iOS 18.2 Beta with AI Features, Including ChatGPT Integration, Boosting Investor Confidence",,2024-10-25T20:40:21Z,,https://consent.yahoo.com/v2/collectConsent?sessionId=1_cc-session_8f500422-e8b0-4db0-95ee-c46b654e985a
Super Micro Investors Whiplashed as Tech Firm Fights For Listing,Carmen Reinicke,2024-11-22T14:08:52Z,"(Bloomberg) -- A roller-coaster ride for Super Micro Computer Inc. shares is likely to continue for some time, as investors weigh the company’s next steps to...",https://finance.yahoo.com/news/super-micro-investors-whiplashed-tech-140852225.html
Gurman: Apple Working on Home ‘Command Center’ for 2025 Launch,Stephen Hackett,2024-11-13T02:08:52Z,"Writing at Bloomberg: Apple Inc., aiming to catch up with rivals in the smart home market, is nearing the launch of a new product category: a wall-mounted display that can control appliances, handle videoconferencing and use AI to navigate apps. The company i…",https://512pixels.net/2024/11/guman-command-center-2025/
"""Mornings Memory"": Revisiting the rise of super-sized portions in America",CBS News,2024-11-01T14:57:00Z,"In today's ""Mornings Memory,"" we look back at a 1993 CBS report on America's growing appetite for large portions and bulk buying—a trend that now feels as classic as apple pie.",https://www.cbsnews.com/video/mornings-memory-revisiting-the-rise-of-super-sized-portions-in-america/
"Apple to buy Pixelmator, maker of popular photo-editing apps",DIGITIMES,2024-11-04T08:43:36Z,"Apple Inc. agreed to buy software maker Pixelmator, adding a popular high-end photo-editing app to its lineup.",https://www.digitimes.com/news/a20241104VL204/apple-apps-acquisition-software.html
FTC charges online shopping tool Sitejabber for fake product reviews,Michael Crider,2024-11-07T15:58:04Z,"The US Federal Trade Commission (FTC) has made some pretty big changes to how companies are allowed to present themselves on the internet, effectively outlawing fake reviews, reviews posted by company employees, fake review sites, AI-generated reviews, etc.
…",https://www.pcworld.com/article/2514153/ftc-charges-online-shopping-tool-sitejabber-for-fake-product-reviews.html
Apple rolls out first AI features and iMac with M4 processor,DIGITIMES,2024-10-29T08:58:52Z,"Apple Inc., heralding a ""new era"" for its devices, started rolling out its first set of Apple Intelligence features and introduced a new 24-inch iMac desktop with an AI-focused M4 processor.",https://www.digitimes.com/news/a20241029VL207/imac-apple-processor-apple-intelligence-eu.html
‘Joker 2’ Is Now Streaming—How To Watch The Blockbuster Flop At Home,"Monica Mercuri, Contributor, 
 Monica Mercuri, Contributor
 https://www.forbes.com/sites/monicamercuri/",2024-10-29T13:23:23Z,"After a disappointing box office run, ""Joker: Folie à Deux"" is now available to stream on digital platforms. Here's how to watch Joaquin Phoenix and Lady Gaga in ""Joker 2.""",https://www.forbes.com/sites/monicamercuri/2024/10/29/joker-2-is-now-streaming-how-to-watch-the-blockbuster-flop-at-home/
Nvidia has lots riding on this week even as earnings a month out,Jeran Wittenstein and Carmen Reinicke,2024-10-28T09:44:51Z,"(Bloomberg) -- Nvidia Corp. isn’t expected to announce earnings for another month, but results this week from the chipmaker’s biggest customers are about to ...",https://finance.yahoo.com/news/nvidia-lots-riding-week-even-094451841.html
"Qualcomm forecasts beats estimates, shares jump 8.5%",Stephen Nellis and Arsheeya  Bajwa,2024-11-06T21:05:17Z,(Reuters) -Chip designer Qualcomm on Wednesday forecast sales and profit in the current quarter would exceed Wall Street estimates as the company benefits a ...,https://finance.yahoo.com/news/qualcomm-forecasts-sales-profits-above-210517607.html
Apple is attempting to get the iPhone 16 Unbanned in Indonesia by proposing to invest up to another US$100 Million over the next 2-Years,Jack Purcher,2024-11-19T03:53:34Z,Tonight a new report claims that Apple Inc. has increased its offer to invest in Indonesia by almost tenfold,https://www.patentlyapple.com/2024/11/apple-is-attempting-to-get-the-iphone-16-unbanned-in-indonesia-by-proposing-to-invest-up-to-another-.html
"Extra $300 Off on selected products (inc, Apple Macbook, Samsung, Motorola) Pickup(NSW) & Delivery @ Mobileciti",AHUANG,2024-11-11T06:59:15Z,"Single Day 3-Hour Hero Deal (8pm~11pm)

Mobileciti is offering an exclusive Singles Day promotion! Get an extra $300 off(Use code: TD300) on a range of top tech products, including popular brands like Apple MacBook, Samsung, and Motorola. More products will b…",https://www.ozbargain.com.au/node/876196
Apple’s Cook Joins CEO Summit with China Premier as Economy Sags,Bloomberg News,2024-11-25T10:21:08Z,"(Bloomberg) -- Apple Inc. Chief Executive Officer Tim Cook joined more than 20 corporate leaders in discussions with China’s premier Monday, as global...",https://finance.yahoo.com/news/apple-chief-returns-china-beijing-025800892.html
"India Rejects Apple’s Request to Pause Antitrust Report, Reuters Says",Susanne Barton,2024-11-24T21:53:03Z,(Bloomberg) -- Apple Inc.’s request to put on hold a report that found it breached competition laws in India was rejected by the country’s antitrust body...,https://finance.yahoo.com/news/india-rejects-apple-request-pause-215303217.html
Test Driving The 2024 Osprey Double Cab Pickup,"Michael Harley, Contributor, 
 Michael Harley, Contributor
 https://www.forbes.com/sites/michaelharley/",2024-11-20T07:04:17Z,"This is not a 1990s-era Land Rover Defender 110 Double Cab Pickup. It's a brand-new vehicle from Osprey Custom Cars assembled in Wilmington, North Carolina.",https://www.forbes.com/sites/michaelharley/2024/11/20/test-driving-the-2024-osprey-double-cab-pickup/
APPLE-SA-10-28-2024-7 tvOS 18.1,,2024-10-29T01:54:15Z,"Posted by Apple Product Security via Fulldisclosure on Oct 28APPLE-SA-10-28-2024-7 tvOS 18.1

tvOS 18.1 addresses the following issues.
Information about the security content is also available at
https://support.apple.com/121569.

Apple maintains a Security R…",https://seclists.org/fulldisclosure/2024/Oct/15
APPLE-SA-10-28-2024-3 macOS Sequoia 15.1,,2024-10-29T01:54:07Z,"Posted by Apple Product Security via Fulldisclosure on Oct 28APPLE-SA-10-28-2024-3 macOS Sequoia 15.1

macOS Sequoia 15.1 addresses the following issues.
Information about the security content is also available at
https://support.apple.com/121564.

Apple main…",https://seclists.org/fulldisclosure/2024/Oct/11
"Redeem Velocity Frequent Flyer Points for Apple Gift Cards, Get 10% Extra Value @ Velocity Rewards Store",JunkCap,2024-11-10T08:21:42Z,"Just found another good deal on Apple gift cards on Velocity Rewards Store. Foundthis post which eventually led me to research and see if I could get gift cards for a cheaper price and Velocity Rewards Store has some.

So, if you have velocity points lying ar…",https://www.ozbargain.com.au/node/875976
New York City Marathon set for Sunday,CBS News,2024-11-01T13:10:00Z,"More than 50,000 runners on Sunday will be taking on the iconic 26.2-mile course through the Big Apple in the New York City Marathon. Ted Metellus, senior VP of events for New York Road Runners, joined CBS News to discuss the race.",https://www.cbsnews.com/video/new-york-city-marathon-set-for-sunday/
What to know about Apple's AI features and who is eligible for them,CBS News,2024-10-28T12:43:00Z,"Apple is gradually rolling out its new AI features it announced over the summer, including for email, Siri and an image tool. However, users will need an iPhone 15 pro or above to access the features. The company has struggled recently with iPhone sales and i…",https://www.cbsnews.com/video/what-to-know-about-apples-ai-features-and-who-is-eligible-for-them/
