Title,Author,PublishedAt,Description,URL
"Alibaba to Offer Notes for Debt Repayment, Share Repurchases",finance.yahoo.com,2024-11-18T03:37:02Z,"In This Article:
(Bloomberg) -- Alibaba Group Holding Ltd. has hired banks to sell dollar and yuan bonds that will be used to pay back offshore debt and buy back shares, following the Chinese tech conglomerate’s issuance of a record convertible bond earlier t…",https://biztoc.com/x/6d6f79ac057d7721
"The Fall of Ant Group's IPO: Alibaba's Missteps, Legal Battles, and a $433.5M Settlement",benzinga.com,2024-11-25T21:34:41Z,"In 2020, Alibaba Group Holding Ltd (NYSE:BABA) prepared for the record-breaking IPO of its affiliate, Ant Group, poised to revolutionize financial technology.
Just days before the launch, regulators revealed that Ant had bypassed key banking laws to expand it…",https://biztoc.com/x/cd1c1067654dbcad
Mongolia’s Prime Minister Looks to Boost All-Important Economic Ties With China,Shannon,2024-11-13T15:32:58Z,"Mongolia and China seem to be moving forward on long-hoped-for cross-border infrastructure and joint energy projects, while stepping up technology cooperation.",https://thediplomat.com/2024/11/mongolias-prime-minister-looks-to-boost-all-important-economic-ties-with-china/
"China, Indonesia seal $10 billion in deals focused on green energy and tech",webdesk@voanews.com (Reuters),2024-11-10T21:08:55Z,"Beijing — China and Indonesia signed deals worth $10 billion at the Indonesia-China Business Forum in Beijing on Sunday, spanning sectors including food, new energy, technology, and biotechnology, Chinese state media reported. 


The forum followed a meeting …",https://www.voanews.com/a/china-indonesia-seal-10-billion-in-deals-focused-on-green-energy-and-tech/7858988.html
"Alibaba's Monetization Strategy Gains Momentum, But GMV Growth Lags: Analyst",aol.com,2024-11-18T20:21:04Z,"Benchmark analyst Fawne Jiang maintained a Buy rating on Alibaba Group Holding (NYSE:BABA) with a price target of $118.
Jiang remarked that Alibaba’s latest earnings report was a mixed bag, offering encouraging signs and areas of concern. While customer manag…",https://biztoc.com/x/793d6a6e2cb380cb
Barclays Issues Pessimistic Forecast for Alibaba Group (NYSE:BABA) Stock Price,MarketBeat News,2024-11-21T09:26:48Z,"Alibaba Group (NYSE:BABA – Get Free Report) had its price target reduced by research analysts at Barclays from $137.00 to $130.00 in a research note issued on Tuesday,Benzinga reports. The brokerage presently has an “overweight” rating on the specialty retail…",https://www.etfdailynews.com/2024/11/21/barclays-issues-pessimistic-forecast-for-alibaba-group-nysebaba-stock-price/
What China's lackluster Singles Day says about Xi Jinping and deflation,asia.nikkei.com,2024-11-18T19:36:32Z,"TOKYO -- When China's mobile payment app Alipay suffered a brief service disruption during this year's Singles Day on Nov. 11, it was a fitting metaphor for just how far the country's online shopping extravaganza has fallen.
Alibaba Group Holding, the e-comme…",https://biztoc.com/x/715db3dc9f8d151a
Head-To-Head Analysis: Augmedix (NASDAQ:AUGX) and Alibaba Group (NYSE:BABA),MarketBeat News,2024-10-30T12:12:49Z,"Augmedix (NASDAQ:AUGX – Get Free Report) and Alibaba Group (NYSE:BABA – Get Free Report) are both medical companies, but which is the better stock? We will contrast the two businesses based on the strength of their analyst recommendations, institutional owner…",https://www.etfdailynews.com/2024/10/30/head-to-head-analysis-augmedix-nasdaqaugx-and-alibaba-group-nysebaba/
Robert W. Baird Raises Alibaba Group (NYSE:BABA) Price Target to $110.00,MarketBeat News,2024-10-27T09:32:57Z,"Alibaba Group (NYSE:BABA – Free Report) had its price target hoisted by Robert W. Baird from $88.00 to $110.00 in a research note issued to investors on Thursday, Benzinga reports. The brokerage currently has an outperform rating on the specialty retailer’s s…",https://www.etfdailynews.com/2024/10/27/robert-w-baird-raises-alibaba-group-nysebaba-price-target-to-110-00/
"Alibaba, NIO Surge Among Monday's Afternoon Market Cap Stock Movers",Investing.com,2024-10-28T18:46:05Z,"Alibaba, NIO Surge Among Monday's Afternoon Market Cap Stock Movers",https://www.investing.com/news/stock-market-news/alibaba-nio-surge-among-mondays-afternoon-market-cap-stock-movers-93CH-3686555
Alibaba to pay $433.5 million to settle shareholder lawsuit over monopoly claims,Reuters,2024-10-26T04:01:06Z,Alibaba to pay $433.5 million to settle shareholder lawsuit over monopoly claims,https://www.investing.com/news/stock-market-news/alibaba-to-pay-4335-million-to-settle-shareholder-lawsuit-over-monopoly-claims-3684492
"Asian Stocks Gain on China Recovery, Weaker Dollar: Markets Wrap",Richard Henderson,2024-11-15T03:42:11Z,"(Bloomberg) -- Asian equities climbed, aided by some encouraging signs in China’s economy and a retreat in the dollar.Most Read from BloombergUnder Trump...",https://finance.yahoo.com/news/dollar-rises-december-fed-cut-222041265.html
Adani Offers Dollar Bond Again After Earlier Deal Postponed,Bloomberg News,2024-11-20T04:20:17Z,Billionaire Gautam Adani’s conglomerate kicked off a dollar bond sale Wednesday after postponing an offering last month when some investors pushed back on pricing.,https://financialpost.com/pmn/business-pmn/adani-offers-dollar-bond-again-after-earlier-deal-postponed
Inflation and retail sales data greet a roaring stock market rally: What to know this week,Josh Schafer,2024-11-10T12:45:52Z,A key inflation reading is set to greet investors amid a roaring post-election rally in markets.,https://finance.yahoo.com/news/inflation-and-retail-sales-data-greet-a-roaring-stock-market-rally-what-to-know-this-week-124552744.html
"AbbVie, Nvidia Lead Friday's Market Cap Stock Movers",Investing.com,2024-11-22T15:38:39Z,"AbbVie, Nvidia Lead Friday's Market Cap Stock Movers",https://www.investing.com/news/stock-market-news/-93CH-3737561
"China's Alibaba misses quarterly revenue estimates, beats on profit",,2024-11-15T12:38:00Z,"Alibaba Group Holding missed analysts' estimates for quarterly sales on Friday (Nov 15), as lingering economic uncertainty sapped consumer spending in China and weighed on the e-commerce giant's domestic business. Its US-listed shares were up 3.3 per cent in …",https://www.channelnewsasia.com/business/chinas-alibaba-misses-quarterly-revenue-estimates-beats-profit-4750116
Southeast Asia’s digital economy slows as consumers cut spending,Bloomberg,2024-11-05T04:23:00Z,"<p>Southeast Asia&rsquo;s internet economy will log its slowest growth on record this year, a group of researchers said, underscoring weakness in consumer demand and a push to show profits instead of revenue gains.</p>",https://www.bangkokpost.com/business/general/2896306/southeast-asias-digital-economy-slows-as-consumers-cut-spending
Sea Needs More Than Good Earnings to Sustain 175% Comeback Rally,Bloomberg News,2024-11-08T00:22:40Z,"After a peer-beating 175% stock rally from its January low, Southeast Asia’s top online-shopping company Sea Ltd. faces a high bar to impress investors with its upcoming third-quarter earnings report.",https://financialpost.com/pmn/business-pmn/sea-needs-more-than-good-earnings-to-sustain-175-comeback-rally
The richest Israelis revealed: Who tops the list?,BY ZVI GREENBERG,2024-11-24T19:40:36Z,Five Israelis have secured positions in Bloomberg’s list of the 500 richest individuals in the world.,https://www.jpost.com/israel-news/article-830549
"China, Indonesia seal $10 bn in deals focused on green energy and tech",Reuters,2024-11-10T17:33:54Z,"Indonesia and China solidified their strategic partnership during Indonesian President Prabowo Subianto's visit to Beijing.  The two nations inked $10 billion worth of deals spanning various sectors, including new energy, technology, and food security.  Agree…",https://economictimes.indiatimes.com/news/international/world-news/china-indonesia-seal-10-bn-in-deals-focused-on-green-energy-and-tech/articleshow/115149922.cms
GraniteShares Announces Reverse Split of NVD,GraniteShares,2024-10-28T16:15:00Z,"NEW YORK, Oct. 28, 2024 (GLOBE NEWSWIRE) -- GraniteShares has announced it will execute a reverse share split for one of its ETFs. The total market value of the shares outstanding will not be affected as a result of the transaction.",https://www.globenewswire.com/news-release/2024/10/28/2970227/0/en/GraniteShares-Announces-Reverse-Split-of-NVD.html
Temu to face EU probe over handling of illegal product sales,,2024-10-31T09:07:02Z,Investigation is part of EU crackdown on Big Tech,https://www.irishtimes.com/business/2024/10/31/temu-to-face-eu-probe-over-handling-of-illegal-product-sales/
Dave Vellante’s Breaking Analysis: The complete collection,Dave Vellante,2024-11-24T11:33:12Z,"Breaking Analysis is a weekly editorial program combining knowledge from SiliconANGLE’s theCUBE with spending data from Enterprise Technology Research. Branded as theCUBE Insights, Powered by ETR, the program is our opportunity to share independent, unfiltere…",https://siliconangle.com/2024/11/24/dave-vellantes-breaking-analysis-complete-collection/
Dave Vellante’s Breaking Analysis: The complete collection,Dave Vellante,2024-11-10T11:33:12Z,"Breaking Analysis is a weekly editorial program combining knowledge from SiliconANGLE’s theCUBE with spending data from Enterprise Technology Research. Branded as theCUBE Insights, Powered by ETR, the program is our opportunity to share independent, unfiltere…",https://siliconangle.com/2024/11/10/dave-vellantes-breaking-analysis-complete-collection/
Dave Vellante’s Breaking Analysis: The complete collection,Dave Vellante,2024-11-15T11:33:12Z,"Breaking Analysis is a weekly editorial program combining knowledge from SiliconANGLE’s theCUBE with spending data from Enterprise Technology Research. Branded as theCUBE Insights, Powered by ETR, the program is our opportunity to share independent, unfiltere…",https://siliconangle.com/2024/11/15/dave-vellantes-breaking-analysis-complete-collection/
Dave Vellante’s Breaking Analysis: The complete collection,Dave Vellante,2024-11-01T10:33:12Z,"Breaking Analysis is a weekly editorial program combining knowledge from SiliconANGLE’s theCUBE with spending data from Enterprise Technology Research. Branded as theCUBE Insights, Powered by ETR, the program is our opportunity to share independent, unfiltere…",https://siliconangle.com/2024/11/01/dave-vellantes-breaking-analysis-complete-collection/
Stock Market Live Updates 14 November 2024: Stock to sell today: Marico (₹597.60),KS Badri Narayanan,2024-11-14T01:16:02Z,"Sensex, Nifty, Share Price LIVE Today: The Marico stock has been depreciating since the beginning of October. It fell off the resistance at ₹700. The scrip continued to fall this week and broke below a support at ₹610 and also below the 200-day moving average…",https://www.thehindubusinessline.com/markets/share-market-nifty-sensex-live-14-november-2024/article68864797.ece
The bright side of supplier concentration: Investor attitudes towards the reopening policy in China,Jie Su,2024-11-18T14:00:00Z,"Supplier concentration (SUC) has disadvantage of vulnerability along with cost savings and efficiency. While current scholarship focus on the vulnerability of firms with centralized suppliers during the COVID-19 epidemic, there is no empirical study that expl…",https://journals.plos.org/plosone/article?id=10.1371/journal.pone.0313682
Stock Market Live Updates 14 November 2024: Sensex and Nifty recover after sharp fall; market uncertainty persists,KS Badri Narayanan,2024-11-14T01:16:02Z,"Sensex, Nifty, Share Price LIVE Today: India’s benchmark indices traded firm in morning trade on Thursday after a sharp decline in the previous session. At 10:05 a.m., the Sensex gained 352.79 points, reaching 78,043.74, while the Nifty rose 98.35 points to 2…",https://www.thehindubusinessline.com/markets/share-market-nifty-sensex-live-updates-14-november-2024/article68864797.ece
